id,name,category,description,price,datetime,location,image_url,url
evt_1077324860659,Welcome Osaka Pub Crawlfree Shot & Fun Chat 2-4 Stores 大阪はしご酒 国際交流,Culture; Nightlife; Cuisine,"Explore Osaka's most vibrant district
Visit 3-5 local pubs to try Japanese drinks such as sake, plum wine, whisky soda and craft beer
Unlimi",Free,2024-11-15T19:00:00+09:00 → 2026-01-02T22:00:00+09:00,"Location HUB心斎橋店 心斎橋筋２丁目６−１４ 中央区 大阪市, 大阪府 542-0085 Get directions",https://cdn.evbuc.com/images/894728673/421848723163/1/logo.20241108-121938,https://www.eventbrite.com/e/welcome-osaka-pub-crawlfree-shot-fun-chat-2-4-stores-tickets-1077324860659
evt_1048557893887,World Summit and Expo on 3D Optical Materials and 2D Photonics Material and,Shopping,"Join us in Bern, Switzerland, on Oct 13–14, 2025, for the 3D Optical & 2D Photonic Materials Summit. Connect, innovate, and shape the future",From $795,2025-10-13T09:00:00+09:00 → 2025-10-13T18:00:00+09:00,"Location Osaka Metropolitan University - Sugimoto Campus 3 Chome-3-138 Sugimoto Osaka, Osaka 558-8585 Get directions",https://cdn.evbuc.com/images/875693929/2400934492453/1/logo.20241016-065411,https://www.eventbrite.com/e/world-summit-and-expo-on-3d-optical-materials-and-2d-photonics-material-and-tickets-1048557893887
evt_1111006182399,zglobalsolution,Culture,"Join us at zglobalsolution for a day of networking, learning, and innovation in the global business world!",Free,2025-08-24T10:00:00+09:00 → 2025-08-24T12:00:00+09:00,"Location Amagasaki 1-15-21 Higashinanamatsuc Amagasaki, Hyōgo 662-0000 Get directions",https://img.evbuc.com/https%3A%2F%2Fcdn.evbuc.com%2Fimages%2F915399283%2F2541416816941%2F1%2Foriginal.png?w=1000&auto=format%2Ccompress&q=75&sharp=10&rect=0%2C0%2C940%2C470&s=8fbe9923c6d20d1caac2735513d42b9f,https://www.eventbrite.com/e/zglobalsolution-tickets-1111006182399
